{
  "$schema": "http://json-schema.org/draft-07/schema#",
  "$id": "https://clawrocket.dev/contracts/editorial-room/v0/optimization_round.schema.json",
  "title": "OptimizationRound",
  "description": "Cached record of one optimization round. See EDITORIAL_ROOM_CONTRACT.md §4.7. NOTE: §4.7 also defines OptimizationTrial (per-candidate audit log) but §10 doesn't list a separate trial schema; deferred to a future batch when fixture/usage emerges.",
  "type": "object",
  "additionalProperties": false,
  "definitions": {
    "RubricScore": {
      "type": "object",
      "additionalProperties": false,
      "required": [
        "axis",
        "score",
        "scale",
        "gap",
        "fix",
        "weakest_quote",
        "note"
      ],
      "properties": {
        "axis": { "type": "string", "minLength": 1 },
        "score": { "type": "number", "description": "Typically 1-5." },
        "scale": {
          "type": "array",
          "items": [{ "type": "number" }, { "type": "number" }],
          "minItems": 2,
          "maxItems": 2,
          "additionalItems": false
        },
        "gap": {
          "anyOf": [{ "type": "null" }, { "type": "string" }],
          "description": "What's missing."
        },
        "fix": {
          "anyOf": [{ "type": "null" }, { "type": "string" }],
          "description": "How to improve."
        },
        "weakest_quote": {
          "anyOf": [{ "type": "null" }, { "type": "string" }],
          "description": "For Draft-level scoring."
        },
        "note": {
          "anyOf": [{ "type": "null" }, { "type": "string" }]
        }
      }
    },
    "SsrPersonaResult": {
      "type": "object",
      "additionalProperties": false,
      "required": [
        "persona_slug",
        "family",
        "pmf",
        "scale",
        "mean",
        "confidence",
        "reasoning_quote"
      ],
      "properties": {
        "persona_slug": { "type": "string", "minLength": 1 },
        "family": {
          "type": "string",
          "minLength": 1,
          "description": "'likelihood' | 'value' | 'appeal' | 'satisfaction' | …"
        },
        "pmf": {
          "type": "array",
          "items": { "type": "number", "minimum": 0, "maximum": 1 },
          "description": "Probability mass function over the Likert scale."
        },
        "scale": {
          "type": "array",
          "items": [{ "type": "number" }, { "type": "number" }],
          "minItems": 2,
          "maxItems": 2,
          "additionalItems": false,
          "description": "e.g., [1, 5]."
        },
        "mean": { "type": "number" },
        "confidence": {
          "type": "number",
          "minimum": 0,
          "maximum": 1,
          "description": "Normalized Shannon entropy [0,1]."
        },
        "reasoning_quote": {
          "anyOf": [{ "type": "null" }, { "type": "string" }],
          "description": "Synthetic free-text response."
        }
      }
    },
    "CounterAudienceObjection": {
      "type": "object",
      "additionalProperties": false,
      "required": ["quoted_line", "objection", "severity"],
      "properties": {
        "quoted_line": {
          "anyOf": [{ "type": "null" }, { "type": "string" }],
          "description": "Line in the draft being objected to."
        },
        "objection": { "type": "string", "minLength": 1 },
        "severity": {
          "type": "string",
          "enum": ["minor", "moderate", "major"]
        }
      }
    },
    "CounterAudienceResult": {
      "type": "object",
      "additionalProperties": false,
      "required": ["persona_slug", "objections"],
      "properties": {
        "persona_slug": { "type": "string", "minLength": 1 },
        "objections": {
          "type": "array",
          "items": { "$ref": "#/definitions/CounterAudienceObjection" }
        }
      }
    },
    "TopKCandidate": {
      "type": "object",
      "additionalProperties": false,
      "required": [
        "rank",
        "rank_basis",
        "candidate_id",
        "candidate_kind",
        "rubric_scores",
        "ssr_distributions",
        "counter_audience",
        "comparable_history",
        "diversity_position",
        "composite_score",
        "novelty_bonus",
        "cohort_coverage_score"
      ],
      "properties": {
        "rank": {
          "type": "integer",
          "minimum": 1,
          "description": "1-indexed."
        },
        "rank_basis": {
          "type": "string",
          "enum": ["composite", "cohort_reservation", "novelty_reservation"]
        },
        "candidate_id": { "type": "string", "minLength": 1 },
        "candidate_kind": {
          "type": "string",
          "minLength": 1,
          "description": "Matches OptimizationRound.target_kind."
        },
        "rubric_scores": {
          "type": "object",
          "additionalProperties": { "$ref": "#/definitions/RubricScore" },
          "description": "Keyed by axis."
        },
        "ssr_distributions": {
          "type": "array",
          "items": { "$ref": "#/definitions/SsrPersonaResult" }
        },
        "counter_audience": {
          "anyOf": [
            { "type": "null" },
            {
              "type": "array",
              "items": { "$ref": "#/definitions/CounterAudienceResult" }
            }
          ],
          "description": "For Drafts only; null otherwise."
        },
        "comparable_history": {
          "anyOf": [{ "type": "null" }, { "type": "string" }],
          "description": "Human-readable comparison ('scores higher than 73% of...')."
        },
        "diversity_position": {
          "anyOf": [{ "type": "null" }, { "type": "string" }],
          "description": "'most novel of top-K' / 'primary cohort' / etc."
        },
        "composite_score": { "type": "number" },
        "novelty_bonus": { "type": "number" },
        "cohort_coverage_score": { "type": "number" }
      }
    }
  },
  "required": [
    "id",
    "schema_version",
    "piece_id",
    "setup_version",
    "target_kind",
    "parent_object",
    "config",
    "status",
    "convergence_reason",
    "started_at",
    "completed_at",
    "candidates_generated",
    "candidates_accepted",
    "acceptable_pool_ids",
    "top_k",
    "reject_reason_histogram",
    "cost_estimate_usd",
    "cost_actual_usd",
    "wallclock_actual_ms",
    "triggered_by_user_id",
    "source_run_ids"
  ],
  "properties": {
    "id": { "type": "string", "minLength": 1, "description": "ULID." },
    "schema_version": { "const": "0" },
    "piece_id": {
      "anyOf": [{ "type": "null" }, { "type": "string", "minLength": 1 }],
      "description": "Null for Theme-search rounds (no parent Piece)."
    },
    "setup_version": {
      "anyOf": [{ "type": "null" }, { "type": "integer", "minimum": 1 }]
    },
    "target_kind": {
      "type": "string",
      "enum": [
        "theme",
        "topic",
        "point",
        "outline",
        "draft_polish",
        "draft_fullsearch"
      ]
    },
    "parent_object": {
      "anyOf": [
        { "type": "null" },
        {
          "type": "object",
          "additionalProperties": false,
          "required": ["kind", "ref"],
          "properties": {
            "kind": { "type": "string", "minLength": 1 },
            "ref": {
              "anyOf": [
                { "type": "null" },
                { "type": "string", "minLength": 1 }
              ]
            }
          }
        }
      ]
    },
    "config": {
      "$ref": "https://clawrocket.dev/contracts/editorial-room/v0/optimization_config.schema.json"
    },
    "status": {
      "type": "string",
      "enum": [
        "queued",
        "running",
        "completed",
        "failed",
        "cancelled",
        "partial"
      ]
    },
    "convergence_reason": {
      "anyOf": [
        { "type": "null" },
        {
          "type": "string",
          "enum": [
            "budget_hit",
            "iteration_max",
            "wallclock_cap",
            "convergence_signal",
            "user_stopped",
            "empty_acceptable_pool",
            "errored"
          ]
        }
      ]
    },
    "started_at": { "type": "string", "format": "date-time" },
    "completed_at": {
      "anyOf": [{ "type": "null" }, { "type": "string", "format": "date-time" }]
    },
    "candidates_generated": { "type": "integer", "minimum": 0 },
    "candidates_accepted": { "type": "integer", "minimum": 0 },
    "acceptable_pool_ids": {
      "type": "array",
      "items": { "type": "string", "minLength": 1 },
      "description": "ULIDs of all accepted candidates (full pool)."
    },
    "top_k": {
      "type": "array",
      "items": { "$ref": "#/definitions/TopKCandidate" },
      "description": "Ranked top-K returned to user."
    },
    "reject_reason_histogram": {
      "type": "object",
      "additionalProperties": { "type": "integer", "minimum": 0 },
      "description": "e.g., { 'specificity_lt_3': 18, 'diversity_lt_0_4': 12 }."
    },
    "cost_estimate_usd": {
      "type": "number",
      "minimum": 0,
      "description": "Pre-launch estimate."
    },
    "cost_actual_usd": { "type": "number", "minimum": 0 },
    "wallclock_actual_ms": { "type": "number", "minimum": 0 },
    "triggered_by_user_id": { "type": "string", "minLength": 1 },
    "source_run_ids": {
      "type": "array",
      "items": { "type": "string", "minLength": 1 },
      "description": "Run_ids of every internal Skill call."
    }
  }
}
