{
  "id": "01HXYZROUND001AAAAAAAAAAAA",
  "schema_version": "0",
  "piece_id": "piece_01HXYZ789ABC",
  "setup_version": 7,
  "target_kind": "topic",
  "parent_object": {
    "kind": "theme",
    "ref": "theme/ai-impact-on-game-dev"
  },
  "config": {
    "schema_version": "0",
    "persona_slugs": [
      "persona/ankit-indie-dev",
      "persona/ravi-studio-lead",
      "persona/mei-publisher"
    ],
    "n_candidates_per_iter": 8,
    "n_iterations": 3,
    "n_winners_carried": 5,
    "n_ssr_samples": 8,
    "top_k_returned": 5,
    "diversity_strategy": "default",
    "diversity_min_distance": 0.4,
    "cohort_targeted_subloops": false,
    "contrast_mutation_fraction": 0.4,
    "gates": {
      "rubric_min": { "specificity": 3, "disputability": 3 },
      "ssr_likelihood_min": 3.5,
      "diversity_min": 0.4,
      "slop_penalty_max": 5.0,
      "ssr_value_min": null
    },
    "objective_weights": {
      "ssr_likelihood_mean": 0.35,
      "ssr_value_mean": 0.2,
      "rubric_composite_mean": 0.3,
      "cohort_coverage": 0.05,
      "cohort_underservice_penalty": -0.05,
      "novelty_bonus": 0.15
    },
    "budget_usd": 5.0,
    "wallclock_cap_ms": null,
    "convergence_min_iters_for_signal": 2,
    "convergence_delta_threshold": 0.05,
    "context": null,
    "voice_slug": "voice/gamemakers-2026",
    "scoring_pipeline_slug": "scoring_pipeline/gamemakers_default"
  },
  "status": "completed",
  "convergence_reason": "convergence_signal",
  "started_at": "2026-04-30T11:30:00.000Z",
  "completed_at": "2026-04-30T11:33:42.180Z",
  "candidates_generated": 24,
  "candidates_accepted": 14,
  "acceptable_pool_ids": [
    "01HXYZCAND001AAAAAAAAAAAAA",
    "01HXYZCAND002BBBBBBBBBBBBB",
    "01HXYZCAND003CCCCCCCCCCCCC",
    "01HXYZCAND004DDDDDDDDDDDDD",
    "01HXYZCAND005EEEEEEEEEEEEE",
    "01HXYZCAND006FFFFFFFFFFFFF",
    "01HXYZCAND007GGGGGGGGGGGGG",
    "01HXYZCAND008HHHHHHHHHHHHH",
    "01HXYZCAND009IIIIIIIIIIIII",
    "01HXYZCAND010JJJJJJJJJJJJJ",
    "01HXYZCAND011KKKKKKKKKKKKK",
    "01HXYZCAND012LLLLLLLLLLLLL",
    "01HXYZCAND013MMMMMMMMMMMMM",
    "01HXYZCAND014NNNNNNNNNNNNN"
  ],
  "top_k": [
    {
      "rank": 1,
      "rank_basis": "composite",
      "candidate_id": "01HXYZCAND001AAAAAAAAAAAAA",
      "candidate_kind": "topic",
      "rubric_scores": {
        "specificity": {
          "axis": "specificity",
          "score": 4.5,
          "scale": [1, 5],
          "gap": null,
          "fix": null,
          "weakest_quote": null,
          "note": null
        },
        "disputability": {
          "axis": "disputability",
          "score": 4,
          "scale": [1, 5],
          "gap": null,
          "fix": null,
          "weakest_quote": null,
          "note": null
        }
      },
      "ssr_distributions": [
        {
          "persona_slug": "persona/ankit-indie-dev",
          "family": "likelihood",
          "pmf": [0.02, 0.05, 0.12, 0.36, 0.45],
          "scale": [1, 5],
          "mean": 4.17,
          "confidence": 0.78,
          "reasoning_quote": "Exactly the angle I haven't seen elsewhere."
        }
      ],
      "counter_audience": null,
      "comparable_history": "Scores higher than 78% of completed Topic-optimize rounds.",
      "diversity_position": "primary cohort",
      "composite_score": 7.82,
      "novelty_bonus": 0.15,
      "cohort_coverage_score": 0.65
    },
    {
      "rank": 2,
      "rank_basis": "composite",
      "candidate_id": "01HXYZCAND002BBBBBBBBBBBBB",
      "candidate_kind": "topic",
      "rubric_scores": {
        "specificity": {
          "axis": "specificity",
          "score": 4,
          "scale": [1, 5],
          "gap": null,
          "fix": null,
          "weakest_quote": null,
          "note": null
        }
      },
      "ssr_distributions": [
        {
          "persona_slug": "persona/ravi-studio-lead",
          "family": "likelihood",
          "pmf": [0.05, 0.1, 0.2, 0.4, 0.25],
          "scale": [1, 5],
          "mean": 3.7,
          "confidence": 0.7,
          "reasoning_quote": "Solid framing."
        }
      ],
      "counter_audience": null,
      "comparable_history": null,
      "diversity_position": null,
      "composite_score": 7.4,
      "novelty_bonus": 0.1,
      "cohort_coverage_score": 0.55
    },
    {
      "rank": 3,
      "rank_basis": "novelty_reservation",
      "candidate_id": "01HXYZCAND008HHHHHHHHHHHHH",
      "candidate_kind": "topic",
      "rubric_scores": {
        "specificity": {
          "axis": "specificity",
          "score": 3.5,
          "scale": [1, 5],
          "gap": null,
          "fix": null,
          "weakest_quote": null,
          "note": null
        }
      },
      "ssr_distributions": [
        {
          "persona_slug": "persona/mei-publisher",
          "family": "likelihood",
          "pmf": [0.1, 0.2, 0.3, 0.3, 0.1],
          "scale": [1, 5],
          "mean": 3.1,
          "confidence": 0.55,
          "reasoning_quote": "Different angle, worth showing."
        }
      ],
      "counter_audience": null,
      "comparable_history": null,
      "diversity_position": "novelty-reserved slot; furthest from primary cluster.",
      "composite_score": 6.8,
      "novelty_bonus": 0.25,
      "cohort_coverage_score": 0.4
    }
  ],
  "reject_reason_histogram": {
    "specificity_lt_3": 4,
    "diversity_lt_0_4": 3,
    "ssr_likelihood_lt_3_5": 2,
    "disputability_lt_3": 1
  },
  "cost_estimate_usd": 4.2,
  "cost_actual_usd": 3.87,
  "wallclock_actual_ms": 222180,
  "triggered_by_user_id": "user_local_joseph",
  "source_run_ids": [
    "01HXYZRUNGEN001AAAAAAAAAAA",
    "01HXYZRUNGEN002BBBBBBBBBBB",
    "01HXYZRUNGEN003CCCCCCCCCCC",
    "01HXYZRUNRUB001DDDDDDDDDDD",
    "01HXYZRUNSSR001EEEEEEEEEEE"
  ]
}
