{
  "id": "01HXYZROUND002BBBBBBBBBBBB",
  "schema_version": "0",
  "piece_id": "piece_01HXYZ789ABC",
  "setup_version": 7,
  "target_kind": "topic",
  "parent_object": {
    "kind": "theme",
    "ref": "theme/ai-impact-on-game-dev"
  },
  "config": {
    "schema_version": "0",
    "persona_slugs": [
      "persona/ankit-indie-dev",
      "persona/ravi-studio-lead",
      "persona/mei-publisher"
    ],
    "n_candidates_per_iter": 8,
    "n_iterations": 3,
    "n_winners_carried": 5,
    "n_ssr_samples": 8,
    "top_k_returned": 5,
    "diversity_strategy": "default",
    "diversity_min_distance": 0.4,
    "cohort_targeted_subloops": false,
    "contrast_mutation_fraction": 0.4,
    "gates": {
      "rubric_min": { "specificity": 3, "disputability": 3 },
      "ssr_likelihood_min": 3.5,
      "diversity_min": 0.4,
      "slop_penalty_max": 5.0,
      "ssr_value_min": null
    },
    "objective_weights": {
      "ssr_likelihood_mean": 0.35,
      "ssr_value_mean": 0.2,
      "rubric_composite_mean": 0.3,
      "cohort_coverage": 0.05,
      "cohort_underservice_penalty": -0.05,
      "novelty_bonus": 0.15
    },
    "budget_usd": 5.0,
    "wallclock_cap_ms": null,
    "convergence_min_iters_for_signal": 2,
    "convergence_delta_threshold": 0.05,
    "context": null,
    "voice_slug": "voice/gamemakers-2026",
    "scoring_pipeline_slug": "scoring_pipeline/gamemakers_default"
  },
  "status": "cancelled",
  "convergence_reason": "user_stopped",
  "started_at": "2026-04-30T12:00:00.000Z",
  "completed_at": "2026-04-30T12:01:32.450Z",
  "candidates_generated": 14,
  "candidates_accepted": 6,
  "acceptable_pool_ids": [
    "01HXYZCAND020AAAAAAAAAAAAA",
    "01HXYZCAND021BBBBBBBBBBBBB",
    "01HXYZCAND022CCCCCCCCCCCCC",
    "01HXYZCAND023DDDDDDDDDDDDD",
    "01HXYZCAND024EEEEEEEEEEEEE",
    "01HXYZCAND025FFFFFFFFFFFFF"
  ],
  "top_k": [
    {
      "rank": 1,
      "rank_basis": "composite",
      "candidate_id": "01HXYZCAND020AAAAAAAAAAAAA",
      "candidate_kind": "topic",
      "rubric_scores": {
        "specificity": {
          "axis": "specificity",
          "score": 4,
          "scale": [1, 5],
          "gap": null,
          "fix": null,
          "weakest_quote": null,
          "note": null
        }
      },
      "ssr_distributions": [
        {
          "persona_slug": "persona/ankit-indie-dev",
          "family": "likelihood",
          "pmf": [0.05, 0.1, 0.2, 0.4, 0.25],
          "scale": [1, 5],
          "mean": 3.7,
          "confidence": 0.65,
          "reasoning_quote": "Worth opening."
        }
      ],
      "counter_audience": null,
      "comparable_history": null,
      "diversity_position": null,
      "composite_score": 7.1,
      "novelty_bonus": 0.1,
      "cohort_coverage_score": 0.5
    }
  ],
  "reject_reason_histogram": {
    "specificity_lt_3": 5,
    "diversity_lt_0_4": 2,
    "ssr_likelihood_lt_3_5": 1
  },
  "cost_estimate_usd": 4.2,
  "cost_actual_usd": 1.84,
  "wallclock_actual_ms": 92450,
  "triggered_by_user_id": "user_local_joseph",
  "source_run_ids": [
    "01HXYZRUNGEN020AAAAAAAAAAA",
    "01HXYZRUNRUB020BBBBBBBBBBB"
  ]
}
